{"artifacts":[{"blake3_first8":"abc12345","path":"artifacts/00-requirements.md"},{"blake3_first8":"fedcba98","path":"artifacts/10-design.md"}],"canonicalization_backend":"jcs-rfc8785","canonicalization_version":"yaml-v1,md-v1","effective_config":{"max_packet_bytes":{"source":"default","value":100000},"model":{"source":"config","value":"haiku"},"strict_lock":{"source":"cli","value":true}},"emitted_at":"2025-01-01T00:00:00Z","fallback_used":true,"last_receipt_path":".xchecker/receipts/example-spec/design.json","lock_drift":{"claude_cli_version":{"current":"0.9.0","locked":"0.8.1"},"model_full_name":{"current":"sonnet","locked":"haiku"},"schema_version":null},"pending_fixups":{"est_added":42,"est_removed":15,"targets":3},"runner":"wsl","runner_distro":"Ubuntu-22.04","schema_version":"1"}